{
  "catalog_version": "guardsynth-source-catalog-v0.1",
  "catalog_id": "guardsynth-kr-structured-road-v0.1",
  "jurisdiction": {
    "country_code": "KR",
    "name": "Republic of Korea",
    "as_of_date": "2026-08-10"
  },
  "odd_scope": {
    "included": [
      "urban_or_suburban_structured_public_road",
      "passenger_vehicle",
      "mapped_or_observed_lane_crossing_signal_and_stop_geometry"
    ],
    "excluded": [
      "emergency_vehicle_exception",
      "railroad_crossing",
      "highway_specific_rule",
      "unstructured_offroad",
      "unverified_adverse_weather_sensor_claim"
    ],
    "outside_odd_reason": "UNSUPPORTED_OUTSIDE_ODD"
  },
  "source_records": [
    {
      "evidence_id": "KR-RTA-2026-ART27",
      "source_class": "LEGAL",
      "authority": "Korea Ministry of Government Legislation, National Law Information Center",
      "title": "Road Traffic Act",
      "uri": "https://www.law.go.kr/lsLinkCommonInfo.do?lsJoLnkSeq=1027503587",
      "version": "Act No. 21246, amended 2025-12-30",
      "effective_date": "2026-07-01",
      "section": "Article 27 paragraphs 1, 2, 3, and 5",
      "verified_date": "2026-08-10",
      "record_hash": "e911b80caa00339f74189842276a96c9f7b924c50f85274d1388fc7413a9c2a6",
      "hash_basis": "CANONICAL_SOURCE_RECORD_NOT_DOCUMENT_BYTES",
      "claims": [
        {"claim_id": "KR-RTA-27-1", "summary": "Stop before the crosswalk or stop line when a pedestrian is crossing or about to cross, without obstructing or endangering the pedestrian.", "normative": true},
        {"claim_id": "KR-RTA-27-2", "summary": "A turning vehicle at a controlled intersection must not obstruct a pedestrian crossing according to the signal or direction.", "normative": true},
        {"claim_id": "KR-RTA-27-3", "summary": "At or near an uncontrolled intersection, a vehicle must not obstruct a pedestrian crossing the road.", "normative": true},
        {"claim_id": "KR-RTA-27-5", "summary": "When a pedestrian crosses a road without a crosswalk, stop while maintaining a safe distance.", "normative": true}
      ]
    },
    {
      "evidence_id": "KR-RTA-2026-ART15-2",
      "source_class": "LEGAL",
      "authority": "Korea Ministry of Government Legislation, National Law Information Center",
      "title": "Road Traffic Act",
      "uri": "https://www.law.go.kr/lsLinkProc.do?joNo=001502000&lsId=001638&mode=2",
      "version": "Act No. 21246, amended 2025-12-30",
      "effective_date": "2026-07-01",
      "section": "Article 15-2 paragraph 3",
      "verified_date": "2026-08-10",
      "record_hash": "983f113b71bc372d9728cb588cc1be78999cb7ec5aefe95ac438cb755e237c5c",
      "hash_basis": "CANONICAL_SOURCE_RECORD_NOT_DOCUMENT_BYTES",
      "claims": [
        {"claim_id": "KR-RTA-15-2-3", "summary": "When a bicycle or personal mobility device is using a bicycle crossing, stop before the crossing or its stop line without obstruction or danger.", "normative": true}
      ]
    },
    {
      "evidence_id": "KR-RTA-2026-ART5",
      "source_class": "LEGAL",
      "authority": "Korea Ministry of Government Legislation, National Law Information Center",
      "title": "Road Traffic Act",
      "uri": "https://www.law.go.kr/LSW/lsInfoP.do?lsId=001638",
      "version": "Act No. 21246, amended 2025-12-30",
      "effective_date": "2026-07-01",
      "section": "Article 5 paragraphs 1 and 2",
      "verified_date": "2026-08-10",
      "record_hash": "4db5697adcbe72ef4c51d9d4972b899606822468c644b1b50906af570e5ce263",
      "hash_basis": "CANONICAL_SOURCE_RECORD_NOT_DOCUMENT_BYTES",
      "claims": [
        {"claim_id": "KR-RTA-5-1", "summary": "Road users must follow traffic safety facility signals or directions and authorized traffic-control directions.", "normative": true},
        {"claim_id": "KR-RTA-5-2", "summary": "When a facility signal conflicts with an authorized traffic-control direction, follow the authorized direction.", "normative": true}
      ]
    },
    {
      "evidence_id": "KR-RTA-RULES-2026-ANNEX2",
      "source_class": "LEGAL",
      "authority": "Korea Ministry of Government Legislation, National Law Information Center",
      "title": "Enforcement Rules of the Road Traffic Act",
      "uri": "https://www.law.go.kr/LSW/lsInfoP.do?lsiSeq=283481",
      "version": "Ministry of the Interior and Safety Ordinance No. 610, amended 2026-02-24",
      "effective_date": "2026-08-01",
      "section": "Article 6 paragraph 2 and Annex 2",
      "verified_date": "2026-08-10",
      "record_hash": "83b9763605c4fb279025450f9124b07a8fe6bd0e730cea68a9cd79f5f1127c3a",
      "hash_basis": "CANONICAL_SOURCE_RECORD_NOT_DOCUMENT_BYTES",
      "claims": [
        {"claim_id": "KR-RULES-A2-RED", "summary": "For a red vehicle signal, stop before the stop line, crosswalk, or intersection; a scoped right turn is permitted only without obstructing other signal-compliant traffic.", "normative": true},
        {"claim_id": "KR-RULES-A2-YELLOW", "summary": "For a yellow vehicle signal, stop before the applicable boundary, or clear the intersection promptly if already entered; a right turn must not obstruct pedestrians.", "normative": true},
        {"claim_id": "KR-RULES-A2-FLASHING-RED", "summary": "For a flashing red vehicle signal, temporarily stop before the applicable boundary and proceed while paying attention to other traffic.", "normative": true},
        {"claim_id": "KR-RULES-A2-FLASHING-YELLOW", "summary": "For a flashing yellow vehicle signal, proceed while paying attention to other traffic and safety signs.", "normative": true}
      ]
    },
    {
      "evidence_id": "KR-RTA-2026-ART19",
      "source_class": "LEGAL",
      "authority": "Korea Ministry of Government Legislation, National Law Information Center",
      "title": "Road Traffic Act",
      "uri": "https://www.law.go.kr/LSW/lsLinkCommonInfo.do?chrClsCd=010202&lsJoLnkSeq=1028652667",
      "version": "Act No. 21246, amended 2025-12-30",
      "effective_date": "2026-07-01",
      "section": "Article 19 paragraphs 1 through 4",
      "verified_date": "2026-08-10",
      "record_hash": "72fea221f26115916d2bdf7835bb2db28a875e51faf79d109efaedee0fb0b439",
      "hash_basis": "CANONICAL_SOURCE_RECORD_NOT_DOCUMENT_BYTES",
      "claims": [
        {"claim_id": "KR-RTA-19-1", "summary": "A following vehicle must maintain the distance necessary to avoid collision if the lead vehicle stops suddenly.", "normative": true},
        {"claim_id": "KR-RTA-19-2", "summary": "When passing a bicycle or personal mobility device traveling in the same direction, pay attention and maintain the distance necessary to avoid collision.", "normative": true},
        {"claim_id": "KR-RTA-19-3", "summary": "Do not change course when the change may obstruct normal traffic approaching in the target direction.", "normative": true},
        {"claim_id": "KR-RTA-19-4", "summary": "Do not stop or decelerate suddenly except to prevent danger or for another unavoidable reason.", "normative": true}
      ]
    },
    {
      "evidence_id": "KR-MOLEG-INTERPRETATION-23-0574",
      "source_class": "OFFICIAL_INTERPRETATION",
      "authority": "Korea Ministry of Government Legislation",
      "title": "Interpretation 23-0574",
      "uri": "https://www.law.go.kr/LSW/expcInfoP.do?expcSeq=336719&mode=2",
      "version": "23-0574, answered 2023-08-04",
      "effective_date": "2023-08-04",
      "section": "Reply and reasoning",
      "verified_date": "2026-08-10",
      "record_hash": "b18c774d10a44129676163baaf8ecd3fe5e6ea499c2ab865a86d237acf03f273",
      "hash_basis": "CANONICAL_SOURCE_RECORD_NOT_DOCUMENT_BYTES",
      "claims": [
        {"claim_id": "KR-INT-23-0574-NONNORMATIVE", "summary": "A bicycle-crossing marking or stop line alone does not itself impose a temporary-stop command absent another applicable signal or direction.", "normative": false}
      ]
    }
  ],
  "predicate_specs": [
    {"predicate_id": "pedestrian_crossing_state", "argument_types": ["actor", "crossing_zone"], "allowed_epistemic": ["OBSERVED", "PREDICTED", "DERIVED"], "coordinate_frame": "ego_path", "observability": "actor track and crossing-zone association", "freshness": {"maximum_age_s": null, "policy": "SOURCE_REQUIRED", "failure_value": "UNKNOWN", "reason_code": "MISSING_FRESHNESS_POLICY"}, "failure_value": "UNKNOWN"},
    {"predicate_id": "bicycle_crossing_state", "argument_types": ["actor", "bicycle_crossing"], "allowed_epistemic": ["OBSERVED", "PREDICTED", "DERIVED"], "coordinate_frame": "ego_path", "observability": "bicycle track and bicycle-crossing association", "freshness": {"maximum_age_s": null, "policy": "SOURCE_REQUIRED", "failure_value": "UNKNOWN", "reason_code": "MISSING_FRESHNESS_POLICY"}, "failure_value": "UNKNOWN"},
    {"predicate_id": "ego_turning_state", "argument_types": ["ego", "intersection"], "allowed_epistemic": ["OBSERVED", "DERIVED"], "coordinate_frame": "ego_path", "observability": "ego trajectory and intersection geometry", "freshness": {"maximum_age_s": null, "policy": "SOURCE_REQUIRED", "failure_value": "UNKNOWN", "reason_code": "MISSING_FRESHNESS_POLICY"}, "failure_value": "UNKNOWN"},
    {"predicate_id": "traffic_control_state", "argument_types": ["control", "lane"], "allowed_epistemic": ["OBSERVED", "DERIVED"], "coordinate_frame": "map", "observability": "control state and verified lane association", "freshness": {"maximum_age_s": null, "policy": "SOURCE_REQUIRED", "failure_value": "UNKNOWN", "reason_code": "MISSING_FRESHNESS_POLICY"}, "failure_value": "UNKNOWN"},
    {"predicate_id": "authorized_direction_state", "argument_types": ["controller", "lane"], "allowed_epistemic": ["OBSERVED"], "coordinate_frame": "map", "observability": "authorized controller direction and lane association", "freshness": {"maximum_age_s": null, "policy": "REVIEW_REQUIRED", "failure_value": "UNKNOWN", "reason_code": "AUTHORIZED_DIRECTION_NOT_MACHINE_VERIFIED"}, "failure_value": "UNKNOWN"},